{
  "$schema": "https://json-schema.org/draft/2020-12/schema",
  "$id": "https://github.com/PlasmaStorm49/musicle-jp/shared/schema/artist.schema.json",
  "title": "Catálogo de artista do musicle-jp",
  "description": "As músicas de um artista para o modo por artista (M13): uma faixa por música. Gerado só pelo pipeline (build-artists). Os $defs comuns são cópias dos do catálogo (um teste confere).",
  "type": "object",
  "additionalProperties": false,
  "required": [
    "schemaVersion",
    "provider",
    "storefront",
    "artistId",
    "fetchedAt",
    "artists",
    "albums",
    "tracks"
  ],
  "properties": {
    "schemaVersion": { "const": 1 },
    "provider": { "type": "string", "pattern": "^[a-z]+$" },
    "storefront": { "type": "string", "pattern": "^[a-z]{2}$" },
    "artistId": { "$ref": "#/$defs/artistId" },
    "fetchedAt": { "$ref": "#/$defs/timestamp" },
    "artists": { "type": "array", "minItems": 1, "items": { "$ref": "#/$defs/artist" } },
    "albums": { "type": "array", "minItems": 1, "items": { "$ref": "#/$defs/album" } },
    "tracks": {
      "type": "array",
      "minItems": 1,
      "maxItems": 200,
      "items": { "$ref": "#/$defs/track" }
    }
  },
  "$defs": {
    "date": { "type": "string", "pattern": "^\\d{4}-\\d{2}-\\d{2}$" },
    "timestamp": { "type": "string", "pattern": "^\\d{4}-\\d{2}-\\d{2}T\\d{2}:\\d{2}:\\d{2}Z$" },
    "text": { "type": "string", "minLength": 1 },
    "optionalText": { "type": ["string", "null"], "minLength": 1 },
    "url": { "type": "string", "pattern": "^[^\\s\\\\]+$" },
    "latinSource": { "enum": ["provider", "manual", "cutlet", null] },
    "artistId": { "type": "string", "pattern": "^[a-z]+:ar:[A-Za-z0-9_-]+$" },
    "albumId": { "type": "string", "pattern": "^[a-z]+:al:[A-Za-z0-9_-]+$" },
    "trackId": { "type": "string", "pattern": "^[a-z]+:tr:[A-Za-z0-9_-]+$" },
    "artistIds": {
      "type": "array",
      "minItems": 1,
      "uniqueItems": true,
      "items": { "$ref": "#/$defs/artistId" }
    },
    "searchKeys": { "type": "array", "uniqueItems": true, "items": { "$ref": "#/$defs/text" } },
    "artist": {
      "type": "object",
      "additionalProperties": false,
      "required": ["id", "name", "nameLatin", "latinSource"],
      "properties": {
        "id": { "$ref": "#/$defs/artistId" },
        "name": { "$ref": "#/$defs/text" },
        "nameLatin": { "$ref": "#/$defs/optionalText" },
        "latinSource": { "$ref": "#/$defs/latinSource" }
      }
    },
    "album": {
      "title": "Álbum do catálogo de artista do musicle-jp",
      "description": "Como o álbum do catálogo, sem os distratores (o modo por artista é só digitado).",
      "type": "object",
      "additionalProperties": false,
      "required": [
        "id",
        "title",
        "titleLatin",
        "latinSource",
        "artistIds",
        "artistDisplay",
        "type",
        "releaseDate",
        "artworkUrl"
      ],
      "properties": {
        "id": { "$ref": "#/$defs/albumId" },
        "title": { "$ref": "#/$defs/text" },
        "titleLatin": { "$ref": "#/$defs/optionalText" },
        "latinSource": { "$ref": "#/$defs/latinSource" },
        "artistIds": { "$ref": "#/$defs/artistIds" },
        "artistDisplay": { "$ref": "#/$defs/text" },
        "type": { "enum": ["single", "album", "ep", "compilation"] },
        "releaseDate": { "$ref": "#/$defs/date" },
        "artworkUrl": { "oneOf": [{ "$ref": "#/$defs/url" }, { "type": "null" }] }
      }
    },
    "preview": {
      "type": "object",
      "additionalProperties": false,
      "required": ["url", "durationSec", "startSec"],
      "properties": {
        "url": { "$ref": "#/$defs/url" },
        "durationSec": { "type": ["number", "null"], "exclusiveMinimum": 0 },
        "startSec": { "type": "number", "minimum": 0 }
      }
    },
    "eligible": {
      "oneOf": [
        {
          "type": "object",
          "additionalProperties": false,
          "required": ["daily", "reason"],
          "properties": { "daily": { "const": true }, "reason": { "const": null } }
        },
        {
          "type": "object",
          "additionalProperties": false,
          "required": ["daily", "reason"],
          "properties": {
            "daily": { "const": false },
            "reason": { "enum": ["no-preview", "short-preview", "no-artwork", "explicit", "blocked"] }
          }
        }
      ]
    },
    "track": {
      "title": "Faixa do catálogo de artista do musicle-jp",
      "description": "Como a faixa do catálogo, sem o histórico da parada (chart) nem o isrc.",
      "type": "object",
      "additionalProperties": false,
      "required": [
        "id",
        "songKey",
        "title",
        "titleLatin",
        "latinSource",
        "artistIds",
        "artistDisplay",
        "albumId",
        "releaseDate",
        "durationMs",
        "explicit",
        "preview",
        "storeUrl",
        "popularity",
        "eligible",
        "search",
        "titleKeys"
      ],
      "properties": {
        "id": { "$ref": "#/$defs/trackId" },
        "songKey": {
          "description": "Chave do título dentro do artista + | + o artista do arquivo (não o principal da faixa: a participação também é dele).",
          "type": "string",
          "pattern": "^.+\\|[a-z]+:ar:[A-Za-z0-9_-]+$"
        },
        "title": { "$ref": "#/$defs/text" },
        "titleLatin": { "$ref": "#/$defs/optionalText" },
        "latinSource": { "$ref": "#/$defs/latinSource" },
        "artistIds": { "$ref": "#/$defs/artistIds" },
        "artistDisplay": { "$ref": "#/$defs/text" },
        "albumId": { "$ref": "#/$defs/albumId" },
        "releaseDate": { "$ref": "#/$defs/date" },
        "durationMs": { "type": "integer", "minimum": 1 },
        "explicit": { "type": "boolean" },
        "preview": { "oneOf": [{ "$ref": "#/$defs/preview" }, { "type": "null" }] },
        "storeUrl": { "oneOf": [{ "$ref": "#/$defs/url" }, { "type": "null" }] },
        "popularity": {
          "description": "Ordem da música no artista: 1 é a primeira (a melhor posição no lookup de músicas da loja), e cai até 1/N. A busca ordena as sugestões por ela.",
          "type": "number",
          "minimum": 0,
          "maximum": 1
        },
        "eligible": { "$ref": "#/$defs/eligible" },
        "search": {
          "description": "Chaves da busca: só o título, sem artista nem álbum (o modo por artista busca só pelo nome da música).",
          "type": "object",
          "additionalProperties": false,
          "required": ["title", "artist"],
          "properties": {
            "title": { "$ref": "#/$defs/searchKeys" },
            "artist": { "type": "array", "maxItems": 0, "items": { "$ref": "#/$defs/text" } }
          }
        },
        "titleKeys": {
          "description": "A chave do título (title_key, a mesma do songKey da parada) de todas as versões da música e a chave do grupo: o jogo tira do sorteio a música que é resposta pendente dos diários de hoje.",
          "type": "array",
          "minItems": 1,
          "uniqueItems": true,
          "items": { "$ref": "#/$defs/text" }
        }
      }
    }
  }
}
