{
  "albums": [
    {
      "artistDisplay": "夜風シアター & 青井ユウ",
      "artistIds": [
        "fixture:ar:ar02",
        "fixture:ar:ar07"
      ],
      "artworkUrl": "fixtures/art/al05.svg",
      "id": "fixture:al:al05",
      "latinSource": "cutlet",
      "releaseDate": "2025-02-14",
      "title": "ふたりの約束 - Single",
      "titleLatin": "Futari no yakusoku",
      "type": "single"
    },
    {
      "artistDisplay": "青井ユウ",
      "artistIds": [
        "fixture:ar:ar07"
      ],
      "artworkUrl": "fixtures/art/al14.svg",
      "id": "fixture:al:al14",
      "latinSource": null,
      "releaseDate": "2026-03-04",
      "title": "Blue Diary",
      "titleLatin": null,
      "type": "album"
    }
  ],
  "artistId": "fixture:ar:ar07",
  "artists": [
    {
      "id": "fixture:ar:ar02",
      "latinSource": "provider",
      "name": "夜風シアター",
      "nameLatin": "Yokaze Theater"
    },
    {
      "id": "fixture:ar:ar07",
      "latinSource": "provider",
      "name": "青井ユウ",
      "nameLatin": "Aoi Yuu"
    }
  ],
  "fetchedAt": "2026-10-05T12:00:00Z",
  "provider": "fixture",
  "schemaVersion": 1,
  "storefront": "jp",
  "tracks": [
    {
      "albumId": "fixture:al:al05",
      "artistDisplay": "夜風シアター & 青井ユウ",
      "artistIds": [
        "fixture:ar:ar02",
        "fixture:ar:ar07"
      ],
      "durationMs": 254000,
      "eligible": {
        "daily": true,
        "reason": null
      },
      "explicit": false,
      "id": "fixture:tr:tr05",
      "latinSource": "cutlet",
      "popularity": 0.75,
      "preview": {
        "durationSec": 30,
        "startSec": 0,
        "url": "fixtures/audio/tr05.wav"
      },
      "releaseDate": "2025-02-14",
      "search": {
        "artist": [],
        "title": [
          "futarinoyakusoku",
          "ふたりの約束"
        ]
      },
      "songKey": "ふたりの約束|fixture:ar:ar07",
      "storeUrl": null,
      "title": "ふたりの約束",
      "titleKeys": [
        "ふたりの約束"
      ],
      "titleLatin": "Futari no yakusoku"
    },
    {
      "albumId": "fixture:al:al14",
      "artistDisplay": "青井ユウ",
      "artistIds": [
        "fixture:ar:ar07"
      ],
      "durationMs": 233000,
      "eligible": {
        "daily": true,
        "reason": null
      },
      "explicit": false,
      "id": "fixture:tr:tr15",
      "latinSource": "cutlet",
      "popularity": 0.5,
      "preview": {
        "durationSec": 30,
        "startSec": 0,
        "url": "fixtures/audio/tr15.wav"
      },
      "releaseDate": "2026-03-04",
      "search": {
        "artist": [],
        "title": [
          "kimito",
          "君と"
        ]
      },
      "songKey": "君と|fixture:ar:ar07",
      "storeUrl": null,
      "title": "君​と❤️",
      "titleKeys": [
        "kimito",
        "君と"
      ],
      "titleLatin": "Kimi to"
    },
    {
      "albumId": "fixture:al:al14",
      "artistDisplay": "青井ユウ",
      "artistIds": [
        "fixture:ar:ar07"
      ],
      "durationMs": 245000,
      "eligible": {
        "daily": true,
        "reason": null
      },
      "explicit": false,
      "id": "fixture:tr:tr27",
      "latinSource": "cutlet",
      "popularity": 1.0,
      "preview": {
        "durationSec": 30,
        "startSec": 0,
        "url": "fixtures/audio/tr27.wav"
      },
      "releaseDate": "2026-03-04",
      "search": {
        "artist": [],
        "title": [
          "kazeninarufeatnana",
          "風になるfeatなな"
        ]
      },
      "songKey": "風になる|fixture:ar:ar07",
      "storeUrl": null,
      "title": "風になる (feat. ナナ)",
      "titleKeys": [
        "風になる"
      ],
      "titleLatin": "Kaze ni naru (feat. Nana)"
    },
    {
      "albumId": "fixture:al:al14",
      "artistDisplay": "青井ユウ",
      "artistIds": [
        "fixture:ar:ar07"
      ],
      "durationMs": 264000,
      "eligible": {
        "daily": true,
        "reason": null
      },
      "explicit": false,
      "id": "fixture:tr:tr41",
      "latinSource": "cutlet",
      "popularity": 0.25,
      "preview": {
        "durationSec": 30,
        "startSec": 0,
        "url": "fixtures/audio/tr41.wav"
      },
      "releaseDate": "2026-03-04",
      "search": {
        "artist": [],
        "title": [
          "himawaribatakedetsukamaete",
          "ひまわり畑でつかまえて"
        ]
      },
      "songKey": "ひまわり畑でつかまえて|fixture:ar:ar07",
      "storeUrl": null,
      "title": "ひまわり畑でつかまえて",
      "titleKeys": [
        "ひまわり畑でつかまえて"
      ],
      "titleLatin": "Himawaribatake de tsukamaete"
    }
  ]
}
